<?xml version="1.0" encoding="UTF-8" standalone="no"?>
<!--
 [y] hybris Platform

 Copyright (c) 2000-2015 hybris AG
 All rights reserved.

 This software is the confidential and proprietary information of hybris
 ("Confidential Information"). You shall not disclose such Confidential
 Information and shall use it only in accordance with the terms of the
 license agreement you entered into with hybris.

--><extensioninfo xmlns:xsi="http://www.w3.org/2001/XMLSchema-instance" xsi:noNamespaceSchemaLocation="extensioninfo.xsd">

	<extension abstractclassprefix="Generated" classprefix="AdyenCockpits" name="adyencockpits">

		<!-- you should add all required extensions to this list -->
		<requires-extension name="acceleratorservices"/>
		<requires-extension name="cscockpit"/>
		<requires-extension name="cmscockpit"/>
		<requires-extension name="productcockpit"/>
		<requires-extension name="reportcockpit"/>
		<requires-extension name="acceleratorcms"/>
		<requires-extension name="adyenServices"/>

	<coremodule generated="true" manager="de.hybris.platform.jalo.extension.GenericManager" packageroot="com.adyen.cockpits"/>
		
		

	</extension>

</extensioninfo>
