<?xml version="1.0" encoding="UTF-8" standalone="no"?>
<!--
 [y] hybris Platform

 Copyright (c) 2000-2015 hybris AG
 All rights reserved.

 This software is the confidential and proprietary information of hybris
 ("Confidential Information"). You shall not disclose such Confidential
 Information and shall use it only in accordance with the terms of the
 license agreement you entered into with hybris.

  
--><extensioninfo xmlns:xsi="http://www.w3.org/2001/XMLSchema-instance" xsi:noNamespaceSchemaLocation="extensioninfo.xsd">

	<extension abstractclassprefix="Generated" classprefix="AdyenAddon" description="adyenAddon extension" managername="AdyenAddonManager" managersuperclass="de.hybris.platform.jalo.extension.Extension" name="adyenAddon">

		<!-- you should add all required extensions to this list, except platform extensions which are automatically required -->         
		<requires-extension name="hmc"/>
		<requires-extension name="acceleratorstorefrontcommons"/>
		<requires-extension name="adyenfacades"/>
		<requires-extension name="adyenServices"/>
		<requires-extension name="addonsupport"/>

		<coremodule generated="true" manager="com.adyen.storefront.jalo.AdyenAddonManager" packageroot="com.adyen.storefront"/>

		<hmcmodule extensionclassname="com.adyen.storefront.hmc.AdyenAddonHMCExtension"/>
					
		

	</extension>

</extensioninfo>
